{
  "meta": {"model_id":"AM-BASELINE-001","phase":"phase-0-baseline","snapshot_sha":"f0d19c34ac03075d64548f1059e9c6626d3596b5","source_basis":"working-tree","status":"degraded","limitations":["Full Draft 2020-12 validator was not installed; deterministic structural and reference validation is authoritative for this receipt.","SCC and cycle counts remain unavailable/degraded.","ProjectSession is absent from production and appears only as an unimplemented target owner."]},
  "views":["compile-time","di-runtime","state-ownership","reactive","persistence","user-flow"],
  "snapshots":{"baseline":"observed","current":"observed","target":"unimplemented"},
  "evidence":[
    {"id":"EV-CT","path":"docs/architecture-migration/maps/compile-time.md","locator":"provisional nodes and CTE-001..CTE-033","confidence":"verified"},
    {"id":"EV-DR","path":"docs/architecture-migration/maps/di-runtime.md","locator":"provisional nodes and DRE-001..DRE-057","confidence":"verified"},
    {"id":"EV-ST","path":"docs/architecture-migration/maps/state-inventory.md","locator":"ST-001..ST-027 inventory rows","confidence":"verified"},
    {"id":"EV-RE","path":"docs/architecture-migration/maps/reactive.md","locator":"RE-001..RE-014 reactive rows","confidence":"verified"},
    {"id":"EV-CF","path":"docs/architecture-migration/maps/characterization-tests.md","locator":"CF-001..CF-022 characterization matrix","confidence":"verified"},
    {"id":"EV-UF","path":"docs/architecture-migration/maps/user-flow.md","locator":"ordered CF-001..CF-022 filter","confidence":"verified"},
    {"id":"EV-UFR","path":"docs/architecture-migration/evidence/user-flow-baseline.md","locator":"status totals and FG-001..FG-020","confidence":"verified"},
    {"id":"EV-PN","path":"docs/architecture-migration/maps/persistence.md","locator":"PN-01..PN-09 and PE-01..PE-08","confidence":"verified"},
    {"id":"EV-PP","path":"docs/architecture-migration/maps/persistence-compatibility.md","locator":"PP-001..PP-122 and compatibility classifications","confidence":"verified"},
    {"id":"EV-SMC","path":"docs/architecture-migration/evidence/persistence-fixtures.md","locator":"SMC-01..SMC-16 fixture ledger","confidence":"verified"},
    {"id":"EV-CG","path":"docs/architecture-migration/evidence/codegraph-baseline.md","locator":"CG-01..CG-05 current source coverage","confidence":"verified"}
  ],
  "nodes":[
    {"id":"CTN-001","kind":"solution","name":"SnowMeltingCalculator.sln","evidence":["EV-CT"],"confidence":"verified","views":["compile-time"],"snapshots":["baseline","current"]},
    {"id":"CTN-002","kind":"project","name":"SnowMeltingCalculator","evidence":["EV-CT"],"confidence":"verified","views":["compile-time"],"snapshots":["baseline","current"]},
    {"id":"CTN-003","kind":"project","name":"SnowMeltingCalculator.Tests","evidence":["EV-CT"],"confidence":"verified","views":["compile-time"],"snapshots":["baseline","current"]},
    {"id":"CTN-004","kind":"namespace","name":"SnowMeltingCalculator.Configuration","evidence":["EV-CT"],"confidence":"verified","views":["compile-time"],"snapshots":["baseline","current"]},
    {"id":"CTN-005","kind":"type","name":"ServiceCollectionExtensions","evidence":["EV-CT"],"confidence":"verified","views":["compile-time"],"snapshots":["baseline","current"]},
    {"id":"CTN-006","kind":"namespace","name":"SnowMeltingCalculator.Services.Project","evidence":["EV-CT"],"confidence":"verified","views":["compile-time"],"snapshots":["baseline","current"]},
    {"id":"CTN-007","kind":"type","name":"ProjectLoadOrchestrator","evidence":["EV-CT"],"confidence":"verified","views":["compile-time"],"snapshots":["baseline","current"]},
    {"id":"CTN-008","kind":"type","name":"ClimateViewModel","evidence":["EV-CT"],"confidence":"verified","views":["compile-time"],"snapshots":["baseline","current"]},
    {"id":"CTN-009","kind":"type","name":"ConstructionViewModel","evidence":["EV-CT"],"confidence":"verified","views":["compile-time"],"snapshots":["baseline","current"]},
    {"id":"CTN-010","kind":"type","name":"ThermalViewModel","evidence":["EV-CT"],"confidence":"verified","views":["compile-time"],"snapshots":["baseline","current"]},
    {"id":"CTN-011","kind":"type","name":"CircuitsViewModel","evidence":["EV-CT"],"confidence":"verified","views":["compile-time"],"snapshots":["baseline","current"]},
    {"id":"CTN-012","kind":"interface","name":"ICalculationStateService","evidence":["EV-CT"],"confidence":"verified","views":["compile-time"],"snapshots":["baseline","current"]},
    {"id":"CTN-013","kind":"interface","name":"IConstructionService","evidence":["EV-CT"],"confidence":"verified","views":["compile-time"],"snapshots":["baseline","current"]},
    {"id":"CTN-014","kind":"type","name":"CalculationContext","evidence":["EV-CT"],"confidence":"verified","views":["compile-time"],"snapshots":["baseline","current"]},
    {"id":"CTN-015","kind":"namespace","name":"Repositories.Construction","evidence":["EV-CT"],"confidence":"verified","views":["compile-time"],"snapshots":["baseline","current"]},
    {"id":"CTN-016","kind":"type","name":"ConstructionRepository","evidence":["EV-CT"],"confidence":"verified","views":["compile-time"],"snapshots":["baseline","current"]},
    {"id":"CTN-017","kind":"interface","name":"IMaterialRepository","evidence":["EV-CT"],"confidence":"verified","views":["compile-time"],"snapshots":["baseline","current"]},
    {"id":"CTN-018","kind":"namespace","name":"Services.Construction","evidence":["EV-CT"],"confidence":"verified","views":["compile-time"],"snapshots":["baseline","current"]},
    {"id":"CTN-019","kind":"type","name":"MaterialNotFoundException","evidence":["EV-CT"],"confidence":"verified","views":["compile-time"],"snapshots":["baseline","current"]},
    {"id":"CTN-020","kind":"type","name":"ResultsViewModel","evidence":["EV-CT"],"confidence":"verified","views":["compile-time"],"snapshots":["baseline","current"]},
    {"id":"CTN-021","kind":"interface","name":"IProjectStateService","evidence":["EV-CT"],"confidence":"verified","views":["compile-time"],"snapshots":["baseline","current"]},
    {"id":"CTN-022","kind":"interface","name":"IMarkDirtyService","evidence":["EV-CT"],"confidence":"verified","views":["compile-time"],"snapshots":["baseline","current"]},
    {"id":"CTN-023","kind":"interface","name":"IDialogService","evidence":["EV-CT"],"confidence":"verified","views":["compile-time"],"snapshots":["baseline","current"]},
    {"id":"CTN-024","kind":"interface","name":"IPdfExportService","evidence":["EV-CT"],"confidence":"verified","views":["compile-time"],"snapshots":["baseline","current"]},
    {"id":"CTN-025","kind":"interface","name":"ICalculationReportExportService","evidence":["EV-CT"],"confidence":"verified","views":["compile-time"],"snapshots":["baseline","current"]},
    {"id":"CTN-026","kind":"interface","name":"IProjectFileService","evidence":["EV-CT"],"confidence":"verified","views":["compile-time"],"snapshots":["baseline","current"]},
    {"id":"CTN-027","kind":"type","name":"ResultsPdfDataBuilder","evidence":["EV-CT"],"confidence":"verified","views":["compile-time"],"snapshots":["baseline","current"]},
    {"id":"CTN-028","kind":"type","name":"HydraulicSummaryBuilder","evidence":["EV-CT"],"confidence":"verified","views":["compile-time"],"snapshots":["baseline","current"]},
    {"id":"CTN-029","kind":"test-type","name":"DiRegistrationTests","evidence":["EV-CT"],"confidence":"verified","views":["compile-time"],"snapshots":["baseline","current"]},
    {"id":"CTN-030","kind":"type","name":"MaterialEditorViewModel","evidence":["EV-CT"],"confidence":"verified","views":["compile-time"],"snapshots":["baseline","current"]},
    {"id":"CTN-031","kind":"type","name":"TemplateEditorViewModel","evidence":["EV-CT"],"confidence":"verified","views":["compile-time"],"snapshots":["baseline","current"]},
    {"id":"DRN-001","kind":"composition-root","name":"AddApplicationServices","evidence":["EV-DR"],"confidence":"verified","views":["di-runtime"],"snapshots":["baseline","current"]},
    {"id":"DRN-002","kind":"composition-module","name":"AddClimateModule","evidence":["EV-DR"],"confidence":"verified","views":["di-runtime"],"snapshots":["baseline","current"]},
    {"id":"DRN-003","kind":"composition-module","name":"AddThermalModule","evidence":["EV-DR"],"confidence":"verified","views":["di-runtime"],"snapshots":["baseline","current"]},
    {"id":"DRN-004","kind":"composition-module","name":"AddConstructionModule","evidence":["EV-DR"],"confidence":"verified","views":["di-runtime"],"snapshots":["baseline","current"]},
    {"id":"DRN-005","kind":"composition-module","name":"AddHydraulicsModule","evidence":["EV-DR"],"confidence":"verified","views":["di-runtime"],"snapshots":["baseline","current"]},
    {"id":"DRN-006","kind":"composition-module","name":"AddNavigationServices","evidence":["EV-DR"],"confidence":"verified","views":["di-runtime"],"snapshots":["baseline","current"]},
    {"id":"DRN-007","kind":"composition-module","name":"AddResultsModule","evidence":["EV-DR"],"confidence":"verified","views":["di-runtime"],"snapshots":["baseline","current"]},
    {"id":"DRN-008","kind":"interface","name":"ICalculationStateService","evidence":["EV-DR"],"confidence":"verified","views":["di-runtime"],"snapshots":["baseline","current"]},
    {"id":"DRN-009","kind":"implementation","name":"CalculationStateService","evidence":["EV-DR"],"confidence":"verified","views":["di-runtime"],"snapshots":["baseline","current"]},
    {"id":"DRN-010","kind":"service","name":"CalculationContext","evidence":["EV-DR"],"confidence":"verified","views":["di-runtime"],"snapshots":["baseline","current"]},
    {"id":"DRN-011","kind":"interface","name":"IProjectStateService","evidence":["EV-DR"],"confidence":"verified","views":["di-runtime"],"snapshots":["baseline","current"]},
    {"id":"DRN-012","kind":"implementation","name":"ProjectStateService","evidence":["EV-DR"],"confidence":"verified","views":["di-runtime"],"snapshots":["baseline","current"]},